[
  {
    "id": "https://infoscience.epfl.ch/entities/orgunit/95372c6b-7d45-432e-a84e-660c9fa54e05",
    "type": "org:Organization",
    "shacl": "pulse:OrganizationShape",
    "identifiers": {
      "pulse:ror": null,
      "pulse:infoscienceOrganizationIdentifier": "https://infoscience.epfl.ch/entities/orgunit/95372c6b-7d45-432e-a84e-660c9fa54e05",
      "pulse:githubOrganizationHandle": "https://github.com/EPFL-ENAC",
      "uuid": "e2c4b6a8-1d3f-4e5a-9b7c-8d6e4f2a1b3c"
    },
    "idSource": "pulse:infoscienceOrganizationIdentifier",
    "schema:name": "EPFL School of Architecture, Civil and Environmental Engineering",
    "schema:identifier": null,
    "pulse:githubOrganizationHandle": "https://github.com/EPFL-ENAC",
    "pulse:infoscienceOrganizationIdentifier": "https://infoscience.epfl.ch/entities/orgunit/95372c6b-7d45-432e-a84e-660c9fa54e05",
    "pulse:OrganizationType": "pulse:University",
    "pulse:githubOrgFollowers": 342,
    "org:hasUnit": [],
    "org:unitOf": [
      "https://ror.org/02s376052"
    ],
    "pulse:owns": [
      "EPFL-ENAC/geodata-toolkit",
      "EPFL-ENAC/structural-analysis"
    ]
  },
  {
    "id": "https://ror.org/02s376052",
    "type": "org:Organization",
    "shacl": "pulse:OrganizationShape",
    "identifiers": {
      "pulse:ror": "https://ror.org/02s376052",
      "pulse:infoscienceOrganizationIdentifier": "https://infoscience.epfl.ch/entities/orgunit/41674f42-ba15-4612-9817-2a6f60985c01",
      "pulse:githubOrganizationHandle": "https://github.com/epaboratories",
      "uuid": "e5a3b1c9-7d8e-4f6a-ab4c-6d8e0f2a4b6c"
    },
    "idSource": "pulse:ror",
    "schema:name": "École Polytechnique Fédérale de Lausanne",
    "schema:identifier": "https://ror.org/02s376052",
    "pulse:infoscienceOrganizationIdentifier": "https://infoscience.epfl.ch/entities/orgunit/41674f42-ba15-4612-9817-2a6f60985c01",
    "pulse:githubOrganizationHandle": "https://github.com/epaboratories",
    "pulse:OrganizationType": "pulse:University",
    "pulse:githubOrgFollowers": 89,
    "org:hasUnit": [
      "https://infoscience.epfl.ch/entities/orgunit/95372c6b-7d45-432e-a84e-660c9fa54e05"
    ],
    "org:unitOf": [],
    "pulse:owns": []
  },
  {
    "id": "https://ror.org/01ggx4157",
    "type": "org:Organization",
    "shacl": "pulse:OrganizationShape",
    "identifiers": {
      "pulse:ror": "https://ror.org/01ggx4157",
      "pulse:infoscienceOrganizationIdentifier": null,
      "pulse:githubOrganizationHandle": null,
      "uuid": "e3b4c5d6-8e9f-4a0b-9c2d-3e4f5a6b7c8d"
    },
    "idSource": "pulse:ror",
    "schema:name": "CERN",
    "pulse:infoscienceOrganizationIdentifier": null,
    "schema:identifier": "https://ror.org/01ggx4157",
    "pulse:githubOrganizationHandle": null,
    "pulse:OrganizationType": "pulse:ResearchInstitution",
    "pulse:githubOrgFollowers": null,
    "org:hasUnit": [],
    "org:unitOf": [],
    "pulse:owns": []
  },
  {
    "id": "https://ror.org/05a28rw58",
    "type": "org:Organization",
    "shacl": "pulse:OrganizationShape",
    "identifiers": {
      "pulse:ror": "https://ror.org/05a28rw58",
      "pulse:infoscienceOrganizationIdentifier": null,
      "pulse:githubOrganizationHandle": null,
      "uuid": "e4d3c2b1-6a5f-4e8d-9c9b-0a1f2e3d4c5b"
    },
    "idSource": "pulse:ror",
    "schema:name": "ETH Zürich",
    "pulse:infoscienceOrganizationIdentifier": null,
    "schema:identifier": "https://ror.org/05a28rw58",
    "pulse:githubOrganizationHandle": null,
    "pulse:OrganizationType": "pulse:University",
    "pulse:githubOrgFollowers": null,
    "org:hasUnit": [],
    "org:unitOf": [],
    "pulse:owns": []
  },
  {
    "id": "numpy",
    "type": "org:Organization",
    "shacl": "pulse:OrganizationShape",
    "identifiers": {
      "pulse:ror": null,
      "pulse:infoscienceOrganizationIdentifier": null,
      "pulse:githubOrganizationHandle": "https://github.com/numpy",
      "uuid": "e6f7a8b9-0c1d-4e2f-9a4b-5c6d7e8f9a0b"
    },
    "idSource": "pulse:githubOrganizationHandle",
    "schema:name": "NumPy",
    "pulse:infoscienceOrganizationIdentifier": null,
    "schema:identifier": null,
    "pulse:githubOrganizationHandle": "https://github.com/numpy",
    "pulse:OrganizationType": "pulse:SoftwareProject",
    "pulse:githubOrgFollowers": 1250,
    "org:hasUnit": [],
    "org:unitOf": [],
    "pulse:owns": []
  }
]
